title,url,date,description,scraped_at
KING OF MACBA 4 - Tiago Lemos VS Adriel Parmisano - YouTube,https://www.youtube.com/watch?v=ndIBllTTP-s,2021-12-02T09:00:11-08:00,"RULESKing of Macba is a game of skate where anything in the plaza count (ledge, stairs etc...) It's one attempt each until the word MACBA is spelled out. Sp...",2026-03-02 22:20:52
Uma manobra nova de Freestyle todos os dias Manobra 58 - Facebook,https://www.facebook.com/reel/780453508466460/,,TodayUma manobra nova de Freestyle todos os dias Manobra 58 - Rail Kickback Frontside Body Varial to Rail #freestyleskateboarding #skateboard #skate #skatebrasil #skatista,2026-03-02 22:20:52
Bastien Salabanzi Talks Macba & How it Became a Legendary Skate Spot,https://shredder.news/bastien-salabanzi-talks-macba/,2023-12-20T03:55:07+00:00,Macba is more than just a spot - it's a hallowed ground where legends are born and the art of skateboarding continues to evolve.,2026-03-02 22:20:52
KING OF MACBA 4 - Petar Stantchev VS Adrien Bulard - Battle 3,https://www.youtube.com/watch?v=_lFaobu7ydY,2021-09-27T08:56:50-07:00,KING OF MACBA 4 - Petar Stantchev VS Adrien Bulard - Battle 3 Macba Life 57K subscribers Subscribe Subscribed,2026-03-02 22:20:52
Go Skateboarding Day 2016 at Macba - Barcelona - YouTube,https://www.youtube.com/watch?v=bDiblF9BDaU,2016-06-22T10:09:45-07:00,Macba is one of the best places to skate in the world so what better place to spend Go Skate Day than at Macba? A bunch of folks got together at Macba to cel...,2026-03-02 22:20:52
GoPro: Skate Queens of Barcelona | MACBA Life - YouTube,https://www.youtube.com/watch?v=pr_heFjClWU,2021-08-31T09:29:50-07:00,"The MACBA Girls take on the iconic plaza 💪 ""Girls with Attitude"" filmed and edited by GoPro Family member Gonzalo Gonzalez De Vega with GoPro HERO9 Black an...",2026-03-02 22:20:52
Adiós al Macba como epicentro mundial del skate - AS.com,https://as.com/deportes_accion/urbano/adios-al-macba-como-epicentro-mundial-del-skate-n/,2024-03-05T12:57:37+01:00,"Mar 5, 2024URBANO Adiós al Macba como epicentro mundial del skate El Ayuntamiento de Barcelona anuncia el proyecto con el que el mítico muro dejará de ser un paraíso skater para convertirse en zona de ...",2026-03-02 22:20:52
Cómo la plaza del Macba se convirtió en meca mundial del monopatín ...,https://www.elperiodico.com/es/ocio-y-cultura/20250305/plaza-macba-convirtio-meca-mundial-monopatin-cultura-skaker-barcelona-historia-118232134,2025-03-05T04:50:56+01:00,"Mar 5, 2025RAVAL Cómo la plaza del Macba se convirtió en meca mundial del monopatín: historia de la cultura 'skater' en Barcelona El inicio de las obras de ampliación del museo amenaza un 'spot' que ...",2026-03-02 22:20:52
MACBA Skate Park,https://macbaskatepark.blogspot.com/,"dimecres, 21 de desembre del 2011
Els skaters s'ap","Principalment trobem dos perfils de skater patinant al MACBA. Un és el perfil del skater estranger que ve a patinar a Barcelona en qualitat de turista, i l'altre és el que viu a Barcelona i hi va a patinar regularment. Un d'aquests estrangers, en Jay, provinent d'Anglaterra, explicava que Barcelona és una de les ciutats mundialment més conegudes, perquè té diferents llocs ...",2026-03-02 22:20:52
Exploring MACBA Skate Spot in Barcelona Spain,https://www.youtube.com/watch?v=cYwurRAGSMU,2022-09-24T13:07:24-07:00,"Today Levi is live on location in Barcelona, Spain. He talks about tricks and tips of visiting MACBA, places to buy boards, food and drinks nearby. Let us know what skate spot we should visit next!",2026-03-02 22:20:52
Skate Style MACBA - YouTube,https://www.youtube.com/watch?v=sb-LPuts0nA,2026-02-10T10:01:04-08:00,Some clips i made at the macba skate spot in Skate StyleGet Skate Style Demo on Steam: https://store.steampowered.com/app/3862790/Skate_Style/,2026-03-02 22:20:52
Barcelona skate spots map - Where to skate in BCN? - La Skateosphere,https://laskateosphere.com/en/the-barcelona-skate-spots-map/,,"A Barcelona skate spots map On holiday in Barcelona? Move quickly from spot to spot with the Barcelona skate spots map. From the most famous Macba to the most original bank. For a better navigation, check the map from a computer and click on the full screen mode at the top right of the skate spots map.",2026-03-02 22:20:53
MSN,https://www.msn.com/en-us/movies/celebrity/barcelonas-famous-macba-skate-spot-the-end-of-an-era/ar-AA1zCBqW,,MSN,2026-03-02 22:20:53
¿Cómo es el MACBA? El sitio más importante de skate del Mundo ...,https://www.youtube.com/watch?v=_riFMRdpHjg,2023-07-25T17:00:08-07:00,Me sorprendí llegar a este lugar por dos cosas. La primera es que es increiblemente brutal y la segunda es que tiene un lado oscuro. Bienvenidos al MACBA en ...,2026-03-02 22:20:53
Skate Spots in Barcelona,https://americansinbarcelona.com/skate-spots-barcelona/,2023-11-13T08:43:01+00:00,"Skate spots in Barcelona MACBA, the most famous skate spot in Barcelona Definitely the most iconic skate spot in the city. MACBA is actually one of the most important museums in the city, and besides the art, this spot also gives the name to the most famous skate spot to practice skateboarding in Barcelona.",2026-03-02 22:20:53
Jart Macba Life Skateboard Deck | SkatePro,https://www.skatepro.com/en-us/209-32019.htm,,"A tribute to one of the most recognizable skate spots in the world Do you plan to go visit Barcelona, the skate capital of Europe? Then you should definitely stop by the well-known Macba Plaza for a session. Just as the name and graphics indicate, The Macba Life skateboard by Jart is designed as a tribute to this influential street spot located just in front of Barcelona's Museum of ...",2026-03-02 22:20:53
King Of MACBA 6: Angelo Caro Vs. Cody Cepeda - YouTube,https://www.youtube.com/watch?v=3WFj7GcZZyw,2024-02-18T08:00:04-08:00,Olympian Angelo Caro takes on the BATB 7 champion Cody Cepeda in the first game of King of MACBA 6 presented by Cariuma with additional support from Blue Tom...,2026-03-02 22:20:53
Macba Life - YouTube,https://www.youtube.com/channel/UCF590iDlsFobw2KwvJq0FfA,,Happy Halloween from MACBA! JP by Luis Beltran #barcelona #skateboarding #skate #macbalife #skater 17K views,2026-03-02 22:20:53
Macba Life - Aurélien Giraud ́s hardflip at the big gap (raw),https://www.youtube.com/watch?v=OfRdB9451fE,2020-04-22T10:10:19-07:00,"That´s was an epic day. Aurelien started trying the trick and the police came, but the agents finally decided to join the audience and let the show continue....",2026-03-02 22:20:53
"Macba Life Dummy 8.2"" Skateboard Deck - Zumiez",https://www.zumiez.com/macba-life-dummy-8-2-skateboard-deck.html,,"From Macba Life, the Dummy skateboard deck arrives in an 8.2"" width, featuring a 32"" length and a 14"" wheelbase for a versatile size with a mellow shape perfect for skating Barcelona's famous art museum. The bottom ply graphic employs a parody of famous art, displaying a skater carrying an oversized, branded beer as reference to a common sight at the famous Catalonian street spot.",2026-03-02 22:20:53
Skateboarding Spots in Barcelona - Sant Jordi Hostels,https://www.santjordihostels.com/skateboarding-spots-in-barcelona/,2010-06-24T12:27:32+00:00,"Macba Skate Spot The Museum for Contemporary Art is just a 15 minute walk from Sant Jordi Hostel Rock Palace. Near the city centre, the MACBA is open for skateboarding on Sundays and Tuesdays. When you get here, you will find a famous huge 4 stair and ledges drops and stairs.",2026-03-02 22:20:53
MACBA expansion at the expense of - catalannews.com,https://www.catalannews.com/society-science/item/macba-expansion-at-the-expense-of-skaters-community-we-are-citizens-too,"First published: APRIL 24, 2025 05:43 PM","Apr 24, 2025MACBA gained its place in the global skating community featuring in many skating videos and even as a level in video games, globally attracting numerous skateboarders. ""You realize MACBA is a sacred place, it's like a holy place for skaters,"" Mario Cano, a skater and skate videographer, tells Catalan News.",2026-03-02 22:20:53
KING of Macba 6 kicks off with an epic battle,https://urbanworldseries.com/news/kingofmacba6contest-kicksoff/,2024-02-20T09:59:59+00:00,"KING of Macba is back with its 6th edition, a game of S.K.A.T.E (M.A.C.B.A) at the meca of Skateboarding: Macba skate spot in Barcelona.",2026-03-02 22:20:53
Rufus (@rufusmacba) • Instagram photos and videos,https://www.instagram.com/rufusmacba/,,"73K Followers, 386 Following, 3,063 Posts - Rufus (@rufusmacba) on Instagram: ""Abiertos todos los días de 11:00 a 20:00""",2026-03-02 22:20:53
Skate no MACBA - Barcelona - YouTube,https://www.youtube.com/watch?v=G0OfVRPzFZU,2011-07-29T08:42:05-07:00,"☾ Confira mais este vídeo produzido em Barcelona, num dos picos mais clássicos da cidade: o MACBA. Muito skate e manobras de peso dos brasileiros e skatistas...",2026-03-02 22:20:53
Barcelona Museum of Contemporary Art (MACBA) - AFAR,https://www.afar.com/places/barcelona-museum-of-contemporary-art-macba-barcelona,,"Get an in-depth review of Barcelona Museum of Contemporary Art (MACBA) in Spain, and details on how to visit.",2026-03-02 22:20:53
Le début de la fin pour les skaters du MACBA à Barcelone,https://www.equinoxmagazine.fr/2025/01/15/travaux-a-barcelone-le-debut-de-la-fin-pour-les-skaters-du-macba/,2025-01-15T01:58:48+01:00,"Jan 15, 2025L'annonce a été faite en mars 2024, mais les travaux ont tout juste débuté : l'iconique plaça dels Angels du MACBA commence sa métamorphose. La place, qui depuis des années était devenue un des lieux les plus connus du monde du skate international va donc expulser les sportifs à roulettes, pour accueillir une extension du musée et surtout le nouveau CAP Raval Nord-Lluis Sayé ...",2026-03-02 22:20:54
macba spot :: Session: Skate Sim General Discussions,https://steamcommunity.com/app/861650/discussions/0/4338725580143841660/,"22 Feb, 2024 @ 5:11pm","dear developers, I think many of the community will not mind that you make a macba spot in the new dlc ???",2026-03-02 22:20:54
"MACBA, una meca 'skater' en perill - elperiodico.cat",https://www.elperiodico.cat/ca/oci-i-cultura/20250222/macba-meca-skater-perill-114591053,2025-02-22T23:26:00+01:00,"Feb 22, 2025L'skate es va fer inseparable del grafiti i va estar present en el naixement de la cultura de club i de l'onada mestissa, amb Ojos de Brujo i Macaco actuant a l'Skateboard Jam Barcelona en què es va celebrar el primer campionat de monopatí de la ciutat. La zona del MACBA es va començar a enlairar com a punt skater a principis del segle ...",2026-03-02 22:20:54
Micro Board Skateboarding at MACBA in Barcelona | TikTok,https://www.tiktok.com/@macbalife/video/7505091122855939351,,"May 16, 2025204 me gusta,Video de TikTok de #MACBALIFE (@macbalife): ""Experience thrilling micro board skating at MACBA in Barcelona. Join us for an epic skateboarding adventure! #macba #tiktokskate #skateboarding"".",2026-03-02 22:20:54
KING OF MACBA 4 - Tiago Lemos VS Nassim Lachhab - Battle 11,https://www.youtube.com/watch?v=dE6G4Z0K1KI,2021-11-04T10:04:35-07:00,"RULESKing of Macba is a game of skate where anything in the plaza count (ledge, stairs etc...) It's one attempt each until the word MACBA is spelled out. Sp...",2026-03-02 22:20:54
"MACBA - Skate Spot in Barcelona, Spain - SkateScope",https://www.skatescope.com/find-spot/macba,"23rd July, 2017","World famous spot!. Stairs, Manual Pad, Ledge",2026-03-02 22:20:54
Welcome to MACBA : r/session - Reddit,https://www.reddit.com/r/session/comments/g73504/welcome_to_macba/,2020-04-24T06:10:22.188Z,A Subreddit for all things relating to Skate 3 and other Skate. games in the franchise! Check out the the Skate 3 discord <need new link> MembersOnline,2026-03-02 22:20:54
Thrasher Magazine - Save MACBA Petition,https://www.thrashermagazine.com/articles/trash/save-macba-petition/,1/13/2025,"Jan 13, 2025Macba's iconic blocks are known by every skater in the world, but they're in danger. Sign the petition to help save this skate landmark.",2026-03-02 22:20:54
Rufus Macba,https://rufusmacba.com/pages/rufus-macba,,"RUFUS MACBA Located in beating heart of the city since 2009, we support skateboarding in all colours, shapes and forms. Find us open Monday to Saturday: 11:00 - 20:00 Sunday: Closed",2026-03-02 22:20:54
"New MACBA Map In Skater XL! | Chill Sesh, Skate Dice Mod, and more!",https://www.youtube.com/watch?v=-zjaZyR_ba8,2021-02-09T12:17:27-08:00,"There are currently 2 versions of Macba floating around, but today we skate around the one that is currently available for everyone. We also briefly check out a version of STPN's Skate Dice mod ...",2026-03-02 22:20:54
MACBA front yard is a big skate park - Tripadvisor,https://www.tripadvisor.com/ShowUserReviews-g187497-d190623-r317837584-MACBA_Museu_d_Art_Contemporani_de_Barcelona-Barcelona_Catalonia.html,,"MACBA Museu d'Art Contemporani de Barcelona: MACBA front yard is a big skate park - See 1,013 traveler reviews, 1,048 candid photos, and great deals for Barcelona, Spain, at Tripadvisor.",2026-03-02 22:20:54
Macba review | True Skate - YouTube,https://www.youtube.com/watch?v=qmvYwHYrbqM,2018-04-09T03:53:09-07:00,"in this video i'll show you guys the skatepark Macba leave a like or not, i'm just doing these videos to show you the park Is this park good or not? - i thin...",2026-03-02 22:20:54
Berrics - Experience the iconic MACBA spot right at your... | Facebook,https://www.facebook.com/berrics/posts/experience-the-iconic-macba-spot-right-at-your-feet-with-this-new-limited-editio/762291829271047/,,Experience the iconic MACBA spot right at your feet with this NEW Limited Edition Skate Register: MACBA board. Now available in the @berricscanteen!! Get...,2026-03-02 22:20:54
Session Skate Jams 5 - MACBA - YouTube,https://www.youtube.com/watch?v=qjs5OEk0cPk,2024-11-26T12:54:25-08:00,clips from MACBA by puzzledpeach#sessionskatesim #session #sessionskategame,2026-03-02 22:20:54
The 7 Best Skate Plazas in the World You Need To Visit,https://www.skateboarding.com/news/best-skate-plazas-in-the-world,2025-03-14T17:10:15Z,"Mar 14, 20253. MACBA, Barcelona, Spain Nothing shined brighter in the early 2000s than the city of Barcelona, Spain. Its Museum of Contemporary Art, aka MACBA, sat smack dab in the middle of the city and was the most epic meet-up spot/spend all day plaza. The four-block in the back became as famous as its ledges out front. Save it by signing this petition!",2026-03-02 22:20:54
Skateboarding Barcelona: Best Guide to the City's Best Spots,https://www.bcn.travel/es/skateboarding-barcelona/,2024-09-15T14:14:43+08:00,"Sep 15, 2024Explore the vibrant skateboarding Barcelona scene - from iconic spots like MACBA to hidden gems, perfect for skaters of all levels.",2026-03-02 22:20:55
"MACBA - Skate Spot in Barcelona, Spain - SkateScope",https://www.skatescope.com/browse/spot/122,"23rd July, 2017","World famous spot!. Stairs, Manual Pad, Ledge",2026-03-02 22:20:55
"Barcelona, una capital skater que dice adiós al Macba",https://www.lavanguardia.com/cultura/20240323/9570582/barcelona-capital-skater-adios-macba.html,2024-03-23T05:00:00Z,"Mar 23, 2024Un joven lanza su monopatín al suelo solo llegar a la plaza dels Àngels, llamada popularmente del Macba porque ahí se ubica el Museo de Arte Contemporáneo de Barcelona. Sus amigos, que se unen ...",2026-03-02 22:20:55
Macba Life - YouTube,https://www.youtube.com/@MacbaLife/videos,,BEST SKATEBOARDING IN THE BEST PLACE IN THE WORLD. We also will still giving to you the best MACBA updates thought instagram & twitter. Subscribe now and be the first to know what happend at MACBA ...,2026-03-02 22:20:55
MACBA Museum of Contemporary Art of Barcelona,https://www.macba.cat/en/,FROM 14 FEBRUARY TO 28 SEPTEMBER 2026,"MACBA functions as a community of knowledge and discovery, complicity and critique, exchange and dialogue. An array of proposals, activities, programmes, publications, exhibitions and encounters configures the everyday life of this communal space that is our Museum.",2026-03-02 22:20:55
The Best Places To Skate In Barcelona - Culture Trip,https://theculturetrip.com/europe/spain/articles/the-best-places-to-skate-in-barcelona,2026-02-28T21:25:32+00:00,"MACBA The Museum of Contemporary Art Barcelona is by far the most recognizable place for skaters around the world. It all began in the late 90s, when the 'MACBA Big Four', was featured in a skate movie called 'Misled Youth.' The Big Four was a ledge with four stairs that were wide enough to do skating tricks on.",2026-03-02 22:20:55
Instagram,https://www.instagram.com/p/DFGiBU6zf7p/,2025-01-21T21:04:25.000Z,"Jan 21, 2025MACBA is one of the most famous skate spots in the world. Known globally for its smooth ground & colorful locals, it has become a proving ground spot that has shaped the skateboarding scene in Barcelona for decades. From its iconic ledges, massive 3/4 block, and heavy out ledge, MACBA has always been a place that welcomed the entire skate community. And now the city is planning on destroying ...",2026-03-02 22:20:55
POLAR SKATE CO. - Page 2 - Rufus Macba,https://rufusmacba.com/collections/polar-skate-co-1?page=2,,"POLAR SKATE CO. - KEYCHAIN | ELEPHANT Regular price €15,00 ← 1 2 →",2026-03-02 22:20:55
"The History of ICONIC Skate Spots 2 (macba, southbank ... - YouTube",https://www.youtube.com/watch?v=GCG4UzJzI4I,2020-05-27T09:00:15-07:00,"The History of ICONIC Skate Spots (El Toro, Lyon 25, Wallenberg) Bari Weiss: Last Week Tonight with John Oliver (HBO) The Dark Side Of Skateboarding - The Story Of Antwuan Dixon",2026-03-02 22:20:55
Macba Life - WE NEED YOU TO SAVE MACBA We just ... - Facebook,https://www.facebook.com/macbalife/posts/-we-need-you-to-save-macba-we-just-created-a-petition-to-the-get-as-much-signatu/1145440750487826/,,"Jan 13, 2025Sending love and strength to @rogerskatesilva , who's going through a tough time with a kidney issue right now. Roger has always been deeply loved by the skate community and especially by everyone at MACBA. His energy, style and presence have meant so much to this plaza and to all of us who've shared sessions with him. We're with you, Roger. Wishing you a smooth recovery and hoping to ...",2026-03-02 22:20:55
STEEZY MACBA Sesh | SKATE STYLE - YouTube,https://www.youtube.com/watch?v=i59KmdMT8Fs,2026-02-08T20:52:05-08:00,steezy macba session in skate style game. You can unlock macba by completing the tutorial or skipping through each specific step until the end. Dont skip all or you will get teleported to the ...,2026-03-02 22:20:55
10 Best Skate Spots in Barcelona You Must Visit | Hostelworld,https://www.hostelworld.com/blog/best-places-skating-barcelona/,2016-10-05T16:16:53+00:00,"Discover Barcelona's best skate spots, from MACBA to Mar Bella Skatepark. Get tips, locations, and insider recommendations for skating in Barcelona!",2026-03-02 22:20:56
"Macba Life Pigeon 8.2"" Skateboard Deck - Zumiez",https://www.zumiez.com/macba-life-pigeon-8-2-skateboard-deck.html,,"Offered in a popular 8.2"" width, Macba Life delivers the Pigeon skateboard deck with a mellow concave and a 7-ply maple construction. Designed to skate the Museum of Contemporary Art in Barcelona aka ""Macba"", the board's graphic displays a sketchbook rendition of a pigeon with a severed head over a black background with branding beneath. The Spanish skate deck is finished with a 32"" length and ...",2026-03-02 22:20:56
Barcelona Skate Spots,https://barcelonaskatespots.wordpress.com/2011/09/08/macba/,2011-09-08T18:19:51+00:00,We would like to show you a description here but the site won't allow us.,2026-03-02 22:20:56
Shop parra cap 6 panel end the (black) online | AMIGOS Skateshop,https://www.amigosskateshop.com/products/parra-cap-6-panel-end-the-black/,,"Order parra cap 6 panel end the (black) online at AMIGOS Skateshop = The best choice at the best price for buying skates, sneakers, and clothing!",2026-03-02 22:20:57
Jart Macba Life Tabla Skateboard | SkatePro,https://www.skatepro.com/es-us/209-32019.htm,,"¿Estás pensando en viajar a Barcelona, el centro neurálgico del skate en Europa? Asegúrate de visitar el icónico Macba Plaza para una sesión. Como se refleja en su nombre y en sus gráficos, el skate Macba Life de Jart es un homenaje a este punto clave de la calle, situado justo enfrente del Museo de Arte Contemporáneo de Barcelona.",2026-03-02 22:20:57
Is this the end of MACBA? We had a quick tchat with Alex Braza from ...,https://sundaiskatemag.com/is-this-the-end-of-macba-we-had-a-quick-tchat-with-alex-braza-from-macba-life-to-know-what-the-hell-is-happening/,2025-03-05T19:12:46+00:00,"Mar 5, 2025This is not the first time that the MACBA plaza has been threatened with being closed off to skateboarders—remember the #SAVEMACBA campaign in 2019 and the great article published on Free—but this time the threat seems very serious. The construction work has indeed started. Part of the plaza has already been closed off, and the 5 stairs have been shut down. Moreover, if we rely on a ...",2026-03-02 22:20:57
Macba gaps - Cafe gap - True Skate - YouTube,https://www.youtube.com/watch?v=DOfTsNZVjMc,2017-09-17T19:20:34-07:00,Macba gaps - Cafe gap - True Skate https://everyplay.com/videos/47211125 Video recorded with Everyplay. Download True Skate on the App Store: https://itunes.apple....more,2026-03-02 22:20:57
MACBA // Skate :: Behance,https://www.behance.net/gallery/35898481/MACBA-Skate,April 8th 2016,715 0 Published: April 8th 2016 skate macba barcelona design editorial magazine Zine vsco concrete series Travel minimal Minimalism skateboarding spain,2026-03-02 22:20:57
Macba Skate Stock Photos - Dreamstime,https://www.dreamstime.com/photos-images/macba-skate.html,,"Download Macba Skate stock photos. Free or royalty-free photos and images. Use them in commercial designs under lifetime, perpetual & worldwide rights. Dreamstime is the world`s largest stock photography community.",2026-03-02 22:20:57
Macba Life skate pendant - Gold,https://macbalife.com/product/macba-life-skate-pendant-gold/,,"In stock Quantity - + Add to cart Buy Now Share Macba Life skate pendant - Gold 94,95 € Add to Cart Shipping and Returns",2026-03-02 22:20:57
Best Barcelona Skatespots - Sant Jordi Hostels,https://www.santjordihostels.com/best-barcelona-skatespots/,2017-10-05T14:26:05+00:00,"Macba Skatespot MACBA is the mecca, really. Recognised by skates across the globe, The Museum of Contemporary Art is without a doubt the number one skate spot in Barcelona. Why is it so famous? Well, in the late 90's it was featured in a movie called 'Misled Youth'. The draw was the 'The Big Four' - a ledge with four stairs that was perfect for tricks, accompanied by a smooth ...",2026-03-02 22:20:57
Shop Macba Life clothing online | skatedeluxe skate shop,https://www.skatedeluxe.com/en/b/macba-life-shop,,"Macba Life With T-shirts, hoodies, beanies, caps & griptape from Macba Life, you're not just paying homage to an iconic spot, but to an entire scene as well. The Macba Life clothing, accessories & skate goods impress with a clear and simple design - just like the architecture of the spot itself.",2026-03-02 22:20:57
