title,url,date,description,scraped_at
How To Access MACBA in Skate Style - YouTube,https://www.youtube.com/watch?v=k4Vr_5MTSu4,2026-02-05T17:15:08-08:00,"I showcase how to skate in MACBA freely in Skate Style, it's pretty simple. All you have to do is access the tutorial, close the game and then relaunch the g...",2026-03-02 22:20:49
Exploring the Legendary MACBA: The Heart of Skateboarding in Barcelona,https://skatesided.com/exploring-the-legendary-macba-the-heart-of-skateboarding-in-barcelona/,2024-08-28,"Aug 28, 2024MACBA isn't just a local favorite; it's a global gathering spot for the skateboarding community. Skaters from all over the world flock to Barcelona to experience MACBA firsthand. On any given day, you'll find a diverse group of skaters—locals and travelers alike—sharing the plaza, filming lines, and cheering each other on.",2026-03-02 22:20:49
MACBA: The Full History Behind This Legendary Spot,https://doseskateboarding.com/articles/macba-the-full-history-behind-this-legendary-spot,2023-11-21T21:59:00Z,"Discover the rich history and vibrant culture behind MACBA (Museu d'Art Contemporani de Barcelona), an iconic skate spot and cultural hub in the Raval neighborhood. Learn about its evolution from a skater's paradise to a symbol of Barcelona's creativity and free expression. Join the global skateboarding community and celebrate the legacy of MACBA.",2026-03-02 22:20:49
MACBA Skate Spot Barcelona - Sant Jordi Hostels,https://www.santjordihostels.com/skateboarding-barcelona-a-locals-guide-macba/,2017-01-01T11:07:42+00:00,"As many may already know or may have heard from a friend, MACBA is "" the skate spot in Barcelona "". Just in front of the Museu d'Art Contemporani de Barcelona, aka MACBA, is the meeting point for skateboarders and the skateboard scene in Barcelona and maybe the world. Even Wikipedia names it as being among ""the most well-known and respected places for modern skateboarding"". The skate ...",2026-03-02 22:20:49
MACBA Is The Place To Skate in Barcelona - Parallel,https://staygenerator.com/parallel/barcelona/sports/macba-is-the-place-to-skate?lang=en-GB,,"Despite the relatively modest sets of steps and ledges - none of which were designed for skating - the space outside the Museu D'Art Contemporani in Barcelona is renowned as any skate park, if not more so, having been cited as ""one of the most well-known and respected places for modern skateboarding."" Officially, skating is only allowed on Tuesdays and Sundays after 2:30pm, but in ...",2026-03-02 22:20:49
MACBA - FindSkateSpots,https://findskatespots.com/spots/barcelona-ct/2-carrer-dels-ngels-macba,,"View location, videos and nearby skate spots of MACBA.",2026-03-02 22:20:49
They are destroying SKATEBORDINGS MECCA - YouTube,https://www.youtube.com/watch?v=jTmn48WVpjs,2025-03-16T11:00:06-07:00,"Don't miss our Top 10 MACBA Tricks ranking at the end! Whether you're a skater, extreme sports enthusiast, or just love the culture, this video is a must-watch.",2026-03-02 22:20:49
We can get back to MACBA...but how? :: Skate Style General Discussions,https://steamcommunity.com/app/3862790/discussions/0/765183962306976515/,,"Actually that guy is right up there, didn't work the first time for me but if you force close when you're in the tutorial it will load up into macba and let you free skate.",2026-03-02 22:20:49
Skateboarding Culture in Barcelona - A Hub for Urban Skaters,https://travelswithbibi.com/skateboarding-culture-in-barcelona/,2024-10-22T14:39:42+00:00,"Oct 22, 2024Key Takeaways Barcelona is a global skateboarding mecca with a rich history from the 1980s. Iconic skate spots like MACBA and Raval significantly influence the city's urban landscape. The local skate community is inclusive and passionate and participates in workshops and events. Skate shops like Amigos and Rufus Macba are central to the local skate scene. Collaboration with the government ...",2026-03-02 22:20:49
MACBA Under Threat as Skaters Fight to Preserve Barcelona's Iconic ...,https://shredder.news/save-macba/,2025-02-25T18:42:05+00:00,"Feb 25, 2025Barcelona's famous Macba skateboarding spot is under threat as skateboarders fight to preserve the iconic plaza.",2026-03-02 22:20:49
Le Dome in Paris & MACBA in Barcelona. Iconic Skate Spots.,https://www.youtube.com/shorts/4qFWkgWl5s4,2026-02-23T07:28:53-08:00,"7 days agoSkating two of the most iconic street skating spots in all of the world. Le Dome in Paris, France and Macba in Barcelona, Spain. Danny Flanagan Waffle Crew.",2026-03-02 22:20:49
Exploring Skateboarding Culture at Macba Barcelona | TikTok,https://www.tiktok.com/@macbalife/video/7549977652128402710,,"Sep 14, 2025Discover the vibrant skateboarding scene at Macba in Barcelona. Join us for an inside look at tricks, community, and passion for skating! #macbalife #skate #barcelona",2026-03-02 22:20:49
Instagram,https://www.instagram.com/p/B-jMfHyABnW/,2020-04-04T07:05:13.000Z,"Serie ""Estados idiosincrásicos"". Título""Skate en Macba"". Año 2018 #forchevisual #Europe #Viaje #travel #photography #Picoftheday #fotos #fotoshot #photograph #photography #fotografo #fotografos #travel #photocolor #barcelona #macba #spain🇪🇸 #españa elcazadordevida 307w Muy buena! 🔝🔥 Like Reply View all 1 replies 352 ...",2026-03-02 22:20:49
ME FALA O QUE VOCÊ ACHOU #viral #foryou #skateboard #macba #crazy - TikTok,https://www.tiktok.com/@maiskate.zip/video/7610812403902680341,,"161 curtidas,Vídeo do TikTok de MAISKATE (@maiskate.zip): ""ME FALA O QUE VOCÊ ACHOU #viral #foryou #skateboard #macba #crazy"".som original - MAISKATE.",2026-03-02 22:20:49
Macba Life - YouTube,https://www.youtube.com/@MacbaLife,,BEST SKATEBOARDING IN THE BEST PLACE IN THE WORLD. We also will still giving to you the best MACBA updates thought instagram & twitter. Subscribe now and be the first to know what happend at MACBA ...,2026-03-02 22:20:49
MACBA SKATEBOARDING BARCELONA (@macba_sb) - Instagram,https://www.instagram.com/macba_sb/,,"9,666 Followers, 1,633 Following, 764 Posts - MACBA SKATEBOARDING BARCELONA (@macba_sb) on Instagram: ""📩 macbaskateboarding@gmail.com #macbasb @macba_sb""",2026-03-02 22:20:49
Keep MACBA skating - Free Skate Magazine,https://www.freeskatemag.com/2019/11/08/keep-macba-skating/,,"MACBA is an odd corner of Barcelona. Not without its problems, but not without its own community and uniqueness. To end skateboarding at MACBA will only serve to disperse this community but sanitise another city space without addressing the underlying issues. Keep MACBA skating. - Jon Fletcher",2026-03-02 22:20:49
Skateboarding Barcelona: Best Guide to the City's Best Spots,https://www.bcn.travel/skateboarding-barcelona/,2024-09-15T14:14:43+08:00,"Sep 15, 2024Explore the vibrant skateboarding Barcelona scene - from iconic spots like MACBA to hidden gems, perfect for skaters of all levels.",2026-03-02 22:20:49
Barcelona's Famous MACBA Skate Spot: The End of an Era,https://www.skateboarding.com/news/barcelonas-famous-macba-skate-spot-the-end-of-an-era,,"Feb 23, 2025Barcelona's Famous SANTS Skate Spot Demolished, Remodel Underway Sad news from the Spanish skate Mecca as photos have surfaced of the famed skate plaza in ruins. However a new plaza is underway with construction expected to take eighteen months. 💻🛹 Don't miss another headline from TransWorld SKATEboarding!",2026-03-02 22:20:49
#macbalife (@macbalife) • Instagram photos and videos,https://www.instagram.com/macbalife/,,"395K Followers, 447 Following, 7,776 Posts - #macbalife (@macbalife) on Instagram: ""#SAVEMACBA #RESPECTTHEPLAZA 🗑 BARCELONA STORE - SALES 👇🏿""",2026-03-02 22:20:49
MACBA: Skate Register | Bastien Salabanzi - The Berrics,http://skatematic.com/skateboard-video/436902/macba-skate-register-bastien-salabanzi/,,"MACBA: Skate Register | Bastien SalabanziThe Museu d'Art Contemporani de Barcelona, or MACBA for short, has become a proving ground spot that has shaped the skateboarding scene in Barcelona for decades. From its iconic ledges, massive 3/4 block, and ...",2026-03-02 22:20:49
MACBA Is The Place To Skate in Barcelona - Parallel,https://staygenerator.com/parallel/barcelona/sports/macba-is-the-place-to-skate,,"Despite the relatively modest sets of steps and ledges - none of which were designed for skating - the space outside the Museu D'Art Contemporani in Barcelona is renowned as any skate park, if not more so, having been cited as ""one of the most well-known and respected places for modern skateboarding."" Officially, skating is only allowed on Tuesdays and Sundays after 2:30pm, but in ...",2026-03-02 22:20:49
Is the skateboarding spot MACBA in Barcelona overrated?,https://www.livetheworld.com/post/is-the-skateboarding-spot-macba-in-barcelona-overrated-u5yp,,"The most prominent place to skate in the world is MACBA. It's a* connection point *of the world of skaters. Brazil, Colombia, US, China, Russia, Norway meet up inside Spain (not inside Spain but inside Catalunia for the politically correct). The place is loaded with a super long ledge, a 5 stair, a big 3 block and some other fancy obstacles.",2026-03-02 22:20:49
Spot was sick! #skate #skateboardingisfun #explorepage #foryou #viral,https://www.facebook.com/reel/995813710001255/,,1 day agoVideo Transcript Gosh bro. Dude. With the broken tail. Pages 󱙿 Public figure 󱙿 Athlete 󱙿 Matthew Parra 󱙿 Videos 󱙿 Spot was sick! #skate #skateboardingisfun #explorepage ...,2026-03-02 22:20:49
Instagram,https://www.instagram.com/p/C4tK5xEiG3u/,,"Mar 19, 202425 likes, 2 comments - grimesydnb on March 19, 2024: ""Babes in Barcelona 🇪🇦 @jakey8 💙 #macba #skateboard #skateboarding"".",2026-03-02 22:20:50
King Of MACBA 6: Leandre Sanders Vs. Chase Webb - YouTube,https://www.youtube.com/watch?v=t9H4YEWqqgo,,"Learn more about one of the most iconic spots of all time, and see why people from all over the world make it a desired destination, in our Skate Register video we did with Bastien Salabanzi ...",2026-03-02 22:20:50
Replying to @lIPEQUEIl wondering how to skateboard? I got you ... - TikTok,https://www.tiktok.com/@switchflipjones/video/7382669273224809771,,"Jun 20, 2024Share edits and showcase your style. Iconic Real-World Maps Barcelona - Skate MACBA and beyond, from plazas to hidden alleys. Stalin Plaza (Prague) - The legendary flatground spot recreated in stunning detail. Built for the Community - Mod support, replay sharing, and regular updates create a platform for skaters, creators, and filmers.",2026-03-02 22:20:50
MACBA Barcelona - LiveSkate,https://liveskate.com/skateparks/barcelona-macba/,,El MACBA de Barcelona: Un museo de arte contemporáneo que también es un icono del skate y la cultura urbana.,2026-03-02 22:20:50
Free Skate Magazine » Khyll Siarot - Smokey,https://www.freeskatemag.com/2026/03/02/khyll-siarot-smokey/,,"TodayLevels of crust that make old London estates look like MACBA, a flick so powerful it, at times, produces the ever-elusive front foot catch (à la Cyrus), and a general aura of raw, untamable energy unlike anything we've seen before - this Filipino banger has all the ingredients to get you hyped for the miraculously somewhat dry week ahead (in the UK at least). Knowing very little about ...",2026-03-02 22:20:50
Barcelona skate spots map - Où skater à BCN ? - La Skateosphere,https://laskateosphere.com/barcelona-skate-spots-map/,,"Barcelona skate spots map En vacances à Barcelone ? Déplacez-vous rapidement de spot en spot grâce à la Barcelona skate spots map. Du plus connu comme le Macba aux plans inclinés les plus originaux. Pour une meilleure navigation, rendez-vous sur un ordinateur et cliquez sur le mode plein écran en haut à droite de la skate spots map.",2026-03-02 22:20:50
KING OF MACBA 5 - Adriel Parmisano VS Levi Leoffelberger - Battle 6,https://www.youtube.com/watch?v=DsoViWjD4IY,2022-11-03T09:53:20-07:00,"King of Macba is a game of skate where anything in the plaza count (ledge, stairs etc...) It's one attempt each until the word MACBA is spelled out. Spots mu...",2026-03-02 22:20:50
Skate Style How to Free Skate on MACBA Map - YouTube,https://www.youtube.com/watch?v=EqkpyTX2yA4,2026-02-06T11:24:55-08:00,This is how you can skate the MACBA Map in the new Skate Style DemoAvailable on Steam: https://store.steampowered.com/app/3862790/Skate_Style/,2026-03-02 22:20:50
MACBA: Skate Register | Bastien Salabanzi - YouTube,https://www.youtube.com/watch?v=8lsVYg7nTNA,2023-12-19T08:00:06-08:00,"The Museu d'Art Contemporani de Barcelona, or MACBA for short, has become a proving ground spot that has shaped the skateboarding scene in Barcelona for deca...",2026-03-02 22:20:50
Macba Life x TransWorld SKATEboarding - MACBA LOVE - YouTube,https://www.youtube.com/watch?v=yVW-WJrK3wE,2025-04-22T02:50:18-07:00,Macba Life x Transworld SKATEboarding - MACBA LOVE Macba Life 56.3K subscribers Subscribed 1,2026-03-02 22:20:50
KING OF MACBA 4 - Gabriel Fortunato VS Tiago Lemos - Battle 13 ...,https://www.youtube.com/watch?v=BLHD7B0JBes,2021-11-18T08:56:06-08:00,"RULESKing of Macba is a game of skate where anything in the plaza count (ledge, stairs etc...) It's one attempt each until the word MACBA is spelled out. Sp...",2026-03-02 22:20:50
Macba Life - YouTube,https://www.youtube.com/c/macbalife,,BEST SKATEBOARDING IN THE BEST PLACE IN THE WORLD. We also will still giving to you the best MACBA updates thought instagram & twitter. Subscribe now and be the first to know what happend at MACBA ...,2026-03-02 22:20:50
Macba Life x Transworld Skateboarding #5 - YouTube,https://www.youtube.com/watch?v=wrCCdOHz9Cw,2017-10-09T06:43:15-07:00,New episode of the Macba Life x Transworld Skateboarding Magazine collabo. Skateboarding in MACBA...more,2026-03-02 22:20:50
the art of skating macba - GoPro,https://gopro.com/en/us/news/the-art-of-skating-macba,"GOPRO TIPS FEB 6, 2019","The Barcelona Museum of Contemporary Art, best known as MACBA, is a famous clutural hotspot in Spain. But for skateboarders, MACBA is a melting pot of raw talent and nationalities that meet here to ride and progress together in the infamous plaza. This mecca of skateboarding and its unique architecture is full of features that are perfect for every style, transforming it into a dream location ...",2026-03-02 22:20:50
Barcelona Skateboarding 〜 The Insiders Guide,https://barcelonanavigator.com/barcelona-skateboarding-guide/,2024-10-10T09:59:00+00:00,"Barcelona offers fantastic skate spots across the city with flat smooth ground and rails, from beside the sea to urban spaces in the heart of the city. Here are the top spots, starting with MACBA, the epicenter of skateboarding in Barcelona.",2026-03-02 22:20:50
"""Le centre du monde du skate"" : la place du MACBA, à Barcelone, risque ...",https://www.radiofrance.fr/franceinfo/podcasts/echos-du-monde/le-centre-du-monde-du-skate-la-place-du-macba-a-barcelone-risque-de-disparaitre-8501590,2025-03-04T14:16:30.000Z,"Mar 4, 2025Après le succès du skate aux Jeux olympiques de Paris, la Mecque mondiale du skate à Barcelone risque de disparaître. La place du MACBA est menacée de démolition, ce qui provoque une levée de boucliers.",2026-03-02 22:20:50
MACBA Famous Ledge has Been Renovated - DOSE Skateboarding,https://doseskateboarding.com/articles/mamba-famous-ledge-has-been-renovated,2020-11-05T09:27:00Z,"MACBA in Barcelona is one of the iconic skate spots in the world. It's a place that many skaters visit just to pay homage to a locale that hundreds of skateboarders have hit up. The spot is so famous that there's an entire group, MACBA Life, dedicated to the Barcelona skating hotspot. They film videos there all the time, but that's not all. MACBA Life makes efforts to keep the MACBA up ...",2026-03-02 22:20:50
DECKS - Macba Life,https://macbalife.com/product-category/skateboards/,,"Macba Life Rasta 8,0´ Skateboard 64,95 €Original price was: 64,95€. 49,95 €Current price is: 49,95€. 100% hard rock maple. Made in Europe. Medium concave.… Add to cart Load more",2026-03-02 22:20:50
Macba Life | Barcelona - Facebook,https://www.facebook.com/macbalife/,,"Macba Life, Barcelona. 21,615 likes · 10,385 talking about this. All about the best skateboarding in MACBA Follow us on instagram",2026-03-02 22:20:50
"Save Barcelona's MACBA Skate Spot, Sign The Petition",https://www.skateboarding.com/news/save-barcelonas-macba-skate-spot-sign-the-petition,2025-01-13T22:42:04Z,"Jan 13, 2025The world famous museum in Barcelona, epicenter of the city's skate scene, is in danger of being destroyed. Sign the petition below to help skaters around the world!",2026-03-02 22:20:50
Patinar en el MACBA de Barcelona - Sant Jordi Hostels,https://www.santjordihostels.com/es/barcelona-skate-spot-macba/,2017-01-01T11:07:42+00:00,"El MACBA como lugar de skate en Barcelona es mundialmente famoso; en realidad un poco demasiado conocido, pero aún así es genial. Todo el mundo habla del suelo liso y plano: «¡Una locura de plano!"" - y los salientes, también lisos, que son perfectos para hacer trucos.",2026-03-02 22:20:50
MACBA off my bucket list shout out to my filmer @Grace ... - TikTok,https://www.tiktok.com/@r08rt/video/7178889521986161925,,"77 Likes, TikTok video from Robert Hetherington (@r08rt): ""MACBA off my bucket list 😎 shout out to my filmer @Grace for surviving the creeps #skate #fyp #macba"". Rapp Snitch Knishes IMUA cover - IMVA.",2026-03-02 22:20:50
Skateurs vs. Mairie de Barcelone : la bataille du MACBA - Equinox,https://www.equinoxmagazine.fr/2024/04/21/travaux-skateurs-macba/,2024-04-21T02:00:42+01:00,"Apr 21, 2024Le plan de réaménagement de la Plaça dels Àngels, place emblématique située devant le musée d'Arts Contemporains du MACBA et spot historique du skate, a été dévoilé en mars dernier par le maire de Barcelone Jaume Collboni.",2026-03-02 22:20:50
GoPro Skate: Best Moments of Spain's MACBA Life 2018,https://www.youtube.com/watch?v=CTtLeUNDzE0,2019-02-06T09:02:20-08:00,"MACBA, Barcelona is famous around the world as the Spanish mecca for skateboarders. This 2018 we teamed up with Macba Life to follow the community of skaters...",2026-03-02 22:20:50
Macba Life - Short Story - YouTube,https://www.youtube.com/watch?v=53c4MHjlykQ,2020-05-13T09:55:52-07:00,The Gopro homies spent a few days in Macba to film with some locals and tell the story of our plaza with this short documentary. Featured skaters: Carlos Ne...,2026-03-02 22:20:50
"""Le centre du monde du skate"" : la place du MACBA, à Barcelone, risque ...",https://www.franceinfo.fr/replay-radio/echos-du-monde/le-centre-du-monde-du-skate-la-place-du-macba-a-barcelone-risque-de-disparaitre_7080696.html,2025-03-04T16:28:53+01:00,"Mar 4, 2025Après le succès de la discipline aux Jeux olympiques de Paris, la Mecque mondiale du skate à Barcelone risque de disparaître. La place du MACBA est menacée de démolition, ce qui provoque une levée de boucliers.",2026-03-02 22:20:50
The Barcelona skate scene overview - livetheworld,https://www.livetheworld.com/post/the-barcelona-skate-scene-overview-hjfh,2022-11-23T15:03:30.662Z,"The long **Macba **ledge and the **Macba big three stairs. The ledge has a lot of random people and people who sell beer. If you have a specific place that you want to skate at Macba, come in the day. At night it's possible to skate the end of the ledge, the flat ground, and the 5 stairs. What you can't skate at night is the outer ledge, unless you ask every person there to move (that would be ...",2026-03-02 22:20:50
Skating The Legendary MACBA Spot! - Session - YouTube,https://www.youtube.com/watch?v=KcGo8NA6rCg,2020-04-27T10:00:08-07:00,"Be ready to play the most authentic and grounded skateboarding experience in the most legendary spots on earth, film and make the gnarliest skate parts out there.",2026-03-02 22:20:50
MSN,https://www.msn.com/en-us/society-culture-and-history/pop-culture/barcelona-s-famous-macba-skate-spot-the-end-of-an-era/ar-AA1zCBqW,,MSN,2026-03-02 22:20:51
Rufus Macba,https://rufusmacba.com/,2025-12-17T19:41:54Z,"Rufus Macba Offers, new products and launching. Directly to your device screen",2026-03-02 22:20:51
Exploring most famous SKATE spot of Barcelona: MACBA,https://www.youtube.com/watch?v=g0XruZcENoA,2022-09-25T13:48:26-07:00,"We enter the MACBA, one of the most famous skate spots in the world located in the Raval neighborhood of Barcelona, Spain. Discover all the skateable corners of this plaza and some of the tricks ...",2026-03-02 22:20:51
"trip to ""MACBA"" Session Skate Sim - YouTube",https://www.youtube.com/watch?v=lWIr9iP8K_E,2024-09-13T15:10:17-07:00,"Recreation of the legendary spot in Barcelona, MACBA by puzzledpeach.Got a few sessions done, great detail, great job.#halftoneskateboards#accessfootwear",2026-03-02 22:20:51
Nice documentary about Barcelona's world famous skate spot. MACBA ...,https://www.reddit.com/r/Barcelona/comments/18srn4l/nice_documentary_about_barcelonas_world_famous/,,Walking past MACBA many people don't realise how legendary this spot is to the world of skateboarding. This video gives a good overview on how MACBA became a skateboarding Mecca.,2026-03-02 22:20:51
Macba and parallel barcelona skateboarding - YouTube,https://www.youtube.com/watch?v=k8g1Y6Vms-c,2025-03-23T05:30:43-07:00,"Skateboarding at MACBA has become a cultural landmark. Parallel also attracts skaters from all over the world. The museum is often bustling with skaters practicing tricks, filming videos, and ...",2026-03-02 22:20:51
Macba skate spot in Barcelona - YouTube,https://www.youtube.com/watch?v=xDFoN5H_pWk,2017-07-11T01:35:39-07:00,"As many may already know or may have heard from a friend, MACBA is ""the skate spot in Barcelona"" More about this spot: https://www.santjordihostels.com/skat......more",2026-03-02 22:20:51
Barcelona Gets A New MACBA - Skateboarding,https://www.skateboarding.com/news/barcelona-gets-a-new-macba,2009-12-24T22:09:16Z,"Barcelona's MACBA, one of the world's most infamous skate spots, comes out of a remodel with new ledges, stairs, and other features.",2026-03-02 22:20:51
Uma manobra nova de Freestyle todos os dias Manobra 57 - Facebook,https://www.facebook.com/reel/1627854171694205/,,1 day agoUma manobra nova de Freestyle todos os dias Manobra 57 - Fakie Backside Nose Hook Impossible 540 #freestyleskateboarding #skateboard #skate #skatebrasil #skatista,2026-03-02 22:20:51
MACBA Life: la república independiente del skate - Yorokobu,https://www.yorokobu.es/macbalife/,2017-05-14T22:16:52+00:00,"La república independiente del skate está en Barcelona. Concretamente, en la Plaça dels Àngels. A las puertas del MACBA, patinadores de todo el mundo acuden ahí para demostrar su destreza. Pero esta plaza es mucho más. En ella se dan cita estudiantes, turistas, cantantes callejeros, vendedores ambulantes… La plaza del MACBA está viva y para demostrarlo ha surgido MACBA Life. «MACBA ...",2026-03-02 22:20:51
"Macba Life Rasta 8,0 ́ Skateboard",https://macbalife.com/product/macba-life-rasta-80-skateboard/,,"Macba Life Rasta 8,0´ Skateboard 64,95 € 49,95 € Add to Cart Shipping and Returns",2026-03-02 22:20:51
Cómo la plaza del Macba se convirtió en meca mundial del monopatín ...,https://www.elperiodico.com/es/cultura/pop/20250222/historia-cultura-skater-barcelona-plaza-macba-114499905,2025-02-22T12:00:44+01:00,"Feb 22, 2025La plaza del Macba más allá del skate: cuando fue la oficina del trap Barcelona diseña para 2027 una plaza dels Àngels con CAP, Macba ampliado y menos 'skaters'",2026-03-02 22:20:51
Macba - YouTube,https://www.youtube.com/watch?v=mWnBfyvtL74,2019-05-09T05:10:40-07:00,"All 14 gaps from the Macba skatepark on the True Skate app, plus a bonus gap of my creation!Music: http://www.bensound.com/royalty-free-music",2026-03-02 22:20:51
Best Skateboarding Spots in Barcelona - Top Places to Shred,https://travelswithbibi.com/best-skateboarding-spots-in-barcelona/,2024-10-22T13:59:29+00:00,"Oct 22, 2024Skate through Barcelona's diverse skateboarding spots, from iconic MACBA to hidden DIY gems; discover what makes each location a must-visit for any skater.",2026-03-02 22:20:51
Skating MACBA & The Streets of Barcelona - YouTube,https://www.youtube.com/watch?v=TXvR-eZ2ZRU,2017-05-31T10:28:59-07:00,More worldwide skate adventures here! http://win.gs/SkateDaWorld Kick it with the locals in Barcelona as we go street-level in the capital city of skateboarding. _...more,2026-03-02 22:20:51
Shop - Macba Life,https://macbalife.com/shop/,,"OG logo Tee - Olive 34,95 €Original price was: 34,95€. 29,95 €Current price is: 29,95€.",2026-03-02 22:20:52
True Skate Official Page | SAVE MACBA! One of the most beloved skate ...,https://www.instagram.com/reel/DGtUwRvtfYn/,,"Mar 2, 20252,891 likes, 17 comments - trueskateofficial on March 2, 2025: ""SAVE MACBA! One of the most beloved skate spots in the world is in danger of getting destroyed and wonderful people over at @macbalife and @savemacba need your help! Head to the link in our bio to sign the petition, use the hashtag #savemacba to raise awareness, follow @savemacba and @macbalife ! This place has so much history ...",2026-03-02 22:20:52
Macba Life - King of Macba 2020 highlights - YouTube,https://www.youtube.com/watch?v=xpEqJ2ZCwd8,2020-04-14T09:42:59-07:00,"A compilation of the King of Macba 2020´s best moments. Featured skaters: Jorge Simoes, Didrik Galasso, Thaynan Costa, Dlamini Dlamini, Nassim Lachhab, Bla...",2026-03-02 22:20:52
The Skater Tribe Flourishing on the Streets of Barcelona,https://supertravelr.com/en/trip/spain/the-skater-tribe-flourishing-on-the-streets-of-barcelona-59E5C2A6DC/,2022-05-31T12:26:33.625Z,"Barcelona is a skater's dream come true, especially at MACBA Square. supertravelr takes a closer look at the local skate scene.",2026-03-02 22:20:52
